{
  "state_version": 20,
  "decision": "EXPLAIN_LAW",
  "target": null,
  "speech": "述述述述述述述述述述述述述述述述述述述述述述述述述述述述述述述述述述述述述述述述述述述述述述述述述述述述述述述述述述述述述述述述述述述述述述述述述述述述述述述述述述述述述述述述述述述述述述述述述述述述述述述述述述述述述述述述述述述述述述述述述述述述述述述述述述述述述述述述述述述述述述述述述述述述述述述述述述述述述述述述述述述述述述述述述述述述述述述述述述述述述述述述述述述述述述述述述述述述述述述述述述述述述述述述述述述述述述述述述述述述述述述述述述述述述述述述述述述述述述述述述述述述述述述述述述述述述述述述述述述述述述述述述述述述述述述述述述述述述述述述述述述述述述述述述述述述述述述述述述述述述述述述述述述述述述述述述述述述述述述述述述述述述述述述述述述述述述述述述述述述述述述述述述述述述述述述述述述述述述述述述述述述述述述述述述述述述述述述述述述述述述述述述述述述述述述述述述述述述述述述述述述述述述述述述述述述述述述述述述述述述述述述述述述述述述述述述述述述述述述述述述述述述述述述述述述述述述述述述述述述述述述述述述述述述述述述述述述述述述述述述述述述述述述述述述述述述述述述述述述述述述述述述述述述述述述述述述述述述述述述述述述述述述述述述述述述述述述述述述述述述述述述述述述述述述述述述述述述述述述述述述述述述述述述述述述述述述述述述述述述述述述述述述述述述述述述述述述述述述述述述述述述述述述述述述述述述述述述述述述述述述述述述述述述述述述述述述述述述述述述述述述述述述述述述述述述述述述述述述述述述述述述述述述述述述述述述述述述述述述述述述述述述述述述述述述述述述述述述述述述述述述述述述述述述述述述述述述述述述述述述述述述述述述述述述述述述述述述述述述述述述述述述述述述述述述述述述述述述述述述述述述述述述述述述述述述述述述述述述述述述述述述述述述述述述述述述述述述述述述述述述述述述述述述述述述述述述述述述述述述述述述述述述述述述述述述述述述述述述述述述述述述述述述述述述述述述述述述述述述述述述述述述述述述述述述述述述述述述述述述述述述述述述述述述述述述述述述述述述述述述述述述述述述述述述述述述述述述述述述述述述述述述述述述述述述述述述述述述述述述述述述述述述述述述述述述述述述述述述述述述述述述述述述述述述述述述述述述述述述述述述述述述述述述述述述述述述述述述述述述述述述述述述述述述述述述述述述述述述述述述述述述述述述述述述述述述述述述述述述述述述述述述述述述述述述述述述述述述述述述述述述述述述述述述述述述述述述述述述述述述述述述述述述述述述述述述述述述述述述述述述述述述述述述述述述述述述述述述述述述述述述述述述述述述述述述述述述述述述述述述述述述述述述述述述述述述述述述述述述述述述述述述述述述述述述述述述述述述述述述述述述述述述述述述述述述述述述述述述述述述述述述述述述述述述述述述述述述述述述述述述述述述述述述述述述述述述述述述述述述述述述述述述述述述述述述述述述述述述述述述述述述述述述述述述述述述述述述述述述述述述述述述述述述述述述述述述述述述述述述述述述述述述述述述述述述述述述述述述述述述述述述述述述述述述述述述述述述述述述述述述述述述述述述述述述述述述述述述述述述述述述述述述述述述述述述述述述述述述述述述述述述述述述述述述述述述述述述述述述述述述述述述述述述述述述述述述述述述述述述述述述述述述述述述述述述述述述述述述述述述述述述述述述述述述述述述述述述述述述述述述述述述述述述述述述述述述述述述述述述述述述述述述述述述述述述述述述述述述述述述述述述述述述述述述述述述述述述述述述述述述述述述述述述述述述述述述述述述述述述述述述述述述述述述述述述述述述述述述述述述述述述述述述述述述述述述述述述述述述述述述述述述述述述述述述述述述述述述述述述述述述述述述述述述述述述述述述述述述述述述述述述述述述述述述述述述述述述述述述述述述述述述述述述述述述述述述述述述述述述述述述述述述述述述述述述述述述述述述述述述述述述述述述述述述述述述述述述述述述述述述述述述述述述述述述述述述述述述述述述述述述述述述述述述述述述述述述述述述述述述述述述述述述述述述述述述述述述述述述述述述述述述述述述述述述述述述述述述述述述述述述述述述述述述述述述述述述述述述述述述述述述述述述述述述述述述述述述述述述述述述述述述述述述述述述述述述述述述述述述述述述述述述述述述述述述述述述述述述述述述述述述述述述述述述述述述述述述述述述述述述述述述述述述述述述述述述述述述述述述述述述述述述述述述述述述述述述述述述述述述述述述述述述述述述述述述述述述述述述述述述述述述述述述述述述述述述述述述述述述述述述述述述述述述述述述述述述述述述述述述述述述述述述述述述述述述述述述述述述述述述述述述述述述述述述述述述述述述述述述述述述述述述述述述述述述述述述述述述述述述述述述述述述述述述述述述述述述述述述述述述述述述述述述述述述述述述述述述述述述述述述述述述述述述述述述述述述述述述述述述述述述述述述述述述述述述述述述述述述述述述述述述述述述述述述述述述述述述述述述述述述述述述述述述述述述述述述述述述述述述述述述述述述述述述述述述述述述述述述述述述述述述述述述述述述述述述述述述述述述述述述述述述述述述述述述述述述述述述述述述述述述述述述述述述述述述述述述述述述述述述述述述述述述述述述述述述述述述述述述述述述述述述述述述述述述述述述述述述述述述述述述述述述述述述述述述述述述述述述述述述述述述述述述述述述述述述述述述述述述述述述述述述述述述述述述述述述述述述述述述述述述述述述述述述述述述述述述述述述述述述述述述述述述述述述述述述述述述述述述述述述述述述述述述述述述述述述述述述述述述述述述述述述述述述述述述述述述述述述述述述述述述述述述述述述述述述述述述述述述述述述述述述述述述述述述述述述述述述述述述述述述述述述述述述述述述述述述述述述述述述述述述述述述述述述述述述述述述述述述述述述述述述述述述述述述述述述述述述述述述述述述述述述述述述述述述述述述述述述述述述述述述述述述述述述述述述述述述述述述述述述述述述述述述述述述述述述述述述述述述述述述述述述述述述述述述述述述述述述述述述述述述述述述述述述述述述述述述述述述述述述述述述述述述述述述述述述述述述述述述述述述述述述述述述述述述述述述述述述述述述述述述述述述述述述述述述述述述述述述述述述述述述述述述述述述述述述述述述述述述述述述述述述述述述述述述述述述述述述述述述述述述述述述述述述述述述述述述述述述述述述述述述述述述述述述述述述述述述述述述述述述述述述述述述述述述述述述述述述述述述述述述述述述述述述述述述述述述述述述述述述述述述述述述述述述述述述述述述述述述述述述述述述述述述述述述述述述述述述述述述述述述述述述述述述述述述述述述述述述述述述述述述述述述述述述述述述述述述述述述述述述述述述述述述述述述述述述述述述述述述述述述述述述述述述述述述述述述述述述述述述述述述述述述述述述述述述述述述述述述述述述述述述述述述述述述述述述述述述述述述述述述述述述述述述述述述述述述述述述述述述述述述述述述述述述述述述述述述述述述述述述述述述述述述述述述述述述述述述述述述述述述述述述述述述述述述述述述述述述述述述述述述述述述述述述述述述述述述述述述述述述述述述述述述述述述述述述述述述述述述述述述述述述述述述述述述述述述述述述述述述述述述述述述述述述述述述述述述述述述述述述述述述述述述述述述述述述述述述述述述述述述述述述述述述述述述述述述述述述述述述述述述述述述述述述述述述述述述述述述述述述述述述述述述述述述述述述述述述述述述述述述述述述述述述述述述述述述述述述述述述述述述述述述述述述述述述述述述述述述述述述述述述述述述述述述述述述述述述述述述述述述述述述述述述述述述述述述述述述述述述述述述述述述述述述述述述述述述述述述述述述述述述述述述述述述述述述述述述述述述述述述述述述述述述述述述述述述述述述述述述述述述述述述述述述述述述述述述述述述述述述述述述述述述述述述述述述述述述述述述述述述述述述述述述述述述述述述述述述述述述述述述述述述述述述述述述述述述述述述述述述述述述述述述述述述述述述述述述述述述述述述述述述述述述述述述述述述述述述述述述述述述述述述述述述述述述述述述述述述述述述述述述述述述述述述述述述述述述述述述述述述述述述述述述述述述述述述述述述述述述述述述述述述述述述述述述述述述述述述述述述述述述述述述述述述述述述述述述述述述述述述述述述述述述述述述述述述述述述述述述述述述述述述述述述述述述述述述述述述述述述述述述述述述述述述述述述述述述述述述述述述述述述述述述述述述述述述述述述述述述述述述述述述述述述述述述述述述述述述述述述述述述述述述述述述述述述述述述述述述述述述述述述述述述述述述述述述述述述述述述述述述述述述述述述述述述述述述述述述述述述述述述述述述述述述述述述述述述述述述述述述述述述述述述述述述述述述述述述述述述述述述述述述述述述述述述述述述述述述述述述述述述述述述述述述述述述述述述述述述述述述述述述述述述述述述述述述述述述述述述述述述述述述述述述述述述述述述述述述述述述述述述述述述述述述述述述述述述述述述述述述述述述述述述述述述述述述述述述述述述述述述述述述述述述述述述述述述述述述述述述述述述述述述述述述述述述述述述述述述述述述述述述述述述述述述述述述述述述述述述述述述述述述述述述述述述述述述述述述述述述述述述述述述述述述述述述述述述述述述述述述述述述述述述述述述述述述述述述述",
  "pending_points": []
}
