{
  "state_version": 20,
  "decision": "ASK",
  "target": "DEFENDANT",
  "speech": "述述述述述述述述述述述述述述述述述述述述述述述述述述述述述述述述述述述述述述述述述述述述述述述述述述述述述述述述述述述述述述述述述述述述述述述述述述述述述述述述述述述述述述述述述述述述述述述述述述述述述述述述述述述述述述述述述述述述述述述述述述述述述述述述述述述述述述述述述述述述述述述述述述述述述述述述述述述述述述述述述述述述述述述述述述述述述述述述述述述述述述述述述述述述述述述述述述述述述述述述述述述述述述述述述述述述述述述述述述述述述述述述述述述述述述述述述述述述述述述述述述述述述述述述述述述述述述述述述述述述述述述述述述述述述述述述述述述述述述述述述述述述述述述述述述述述述述述述述述述述述述述述述述述述述述述述述述述述述述述述述述述述述述述述述述述述述述述述述述述述述述述述述述述述述述述述述述述述述述述述述述述述述述述述述述述述述述述述述述述述述述述述述述述述述述述述述述述述述述述述述述述述述述述述述述述述述述述述述述述述述述述述述述述述述述述述述述述述述述述述述述述述述述述述述述述述述述述述述述述述述述述述述述述述述述述述述述述述述述述述述述述述述述述述述述述述述述述述述述述述述述述述述述述述述述述述述述述述述述述述述述述述述述述述述述述述述述述述述述述述述述述述述述述述述述述述述述述述述述述述述述述述述述述述述述述述述述述述述述述述述述述述述述述述述述述述述述述述述述述述述述述述述述述述述述述述述述述述述述述述述述述述述述述述述述述述述述述述述述述述述述述述述述述述述述述述述述述述述述述述述述述述述述述述述述述述述述述述述述述述述述述述述述述述述述述述述述述述述述述述述述述述述述述述述述述述述述述述述述述述述述述述述述述述述述述述述述述述述述述述述述述述述述述述述述述述述述述述述述述述述述述述述述述述述述述述述述述述述述述述述述述述述述述述述述述述述述述述述述述述述述述述述述述述述述述述述述述述述述述述述述述述述述述述述述述述述述述述述述述述述述述述述述述述述述述述述述述述述述述述述述述述述述述述述述述述述述述述述述述述述述述述述述述述述述述述述述述述述述述述述述述述述述述述述述述述述述述述述述述述述述述述述述述述述述述述述述述述述述述述述述述述述述述述述述述述述述述述述述述述述述述述述述述述述述述述述述述述述述述述述述述述述述述述述述述述述述述述述述述述述述述述述述述述述述述述述述述述述述述述述述述述述述述述述述述述述述述述述述述述述述述述述述述述述述述述述述述述述述述述述述述述述述述述述述述述述述述述述述述述述述述述述述述述述述述述述述述述述述述述述述述述述述述述述述述述述述述述述述述述述述述述述述述述述述述述述述述述述述述述述述述述述述述述述述述述述述述述述述述述述述述述述述述述述述述述述述述述述述述述述述述述述述述述述述述述述述述述述述述述述述述述述述述述述述述述述述述述述述述述述述述述述述述述述述述述述述述述述述述述述述述述述述述述述述述述述述述述述述述述述述述述述述述述述述述述述述述述述述述述述述述述述述述述述述述述述述述述述述述述述述述述述述述述述述述述述述述述述述述述述述述述述述述述述述述述述述述述述述述述述述述述述述述述述述述述述述述述述述述述述述述述述述述述述述述述述述述述述述述述述述述述述述述述述述述述述述述述述述述述述述述述述述述述述述述述述述述述述述述述述述述述述述述述述述述述述述述述述述述述述述述述述述述述述述述述述述述述述述述述述述述述述述述述述述述述述述述述述述述述述述述述述述述述述述述述述述述述述述述述述述述述述述述述述述述述述述述述述述述述述述述述述述述述述述述述述述述述述述述述述述述述述述述述述述述述述述述述述述述述述述述述述述述述述述述述述述述述述述述述述述述述述述述述述述述述述述述述述述述述述述述述述述述述述述述述述述述述述述述述述述述述述述述述述述述述述述述述述述述述述述述述述述述述述述述述述述述述述述述述述述述述述述述述述述述述述述述述述述述述述述述述述述述述述述述述述述述述述述述述述述述述述述述述述述述述述述述述述述述述述述述述述述述述述述述述述述述述述述述述述述述述述述述述述述述述述述述述述述述述述述述述述述述述述述述述述述述述述述述述述述述述述述述述述述述述述述述述述述述述述述述述述述述述述述述述述述述述述述述述述述述述述述述述述述述述述述述述述述述述述述述述述述述述述述述述述述述述述述述述述述述述述述述述述述述述述述述述述述述述述述述述述述述述述述述述述述述述述述述述述述述述述述述述述述述述述述述述述述述述述述述述述述述述述述述述述述述述述述述述述述述述述述述述述述述述述述述述述述述述述述述述述述述述述述述述述述述述述述述述述述述述述述述述述述述述述述述述述述述述述述述述述述述述述述述述述述述述述述述述述述述述述述述述述述述述述述述述述述述述述述述述述述述述述述述述述述述述述述述述述述述述述述述述述述述述述述述述述述述述述述述述述述述述述述述述述述述述述述述述述述述述述述述述述述述述述述述述述述述述述述述述述述述述述述述述述述述述述述述述述述述述述述述述述述述述述述述述述述述述述述述述述述述述述述述述述述述述述述述述述述述述述述述述述述述述述述述述述述述述述述述述述述述述述述述述述述述述述述述述述述述述述述述述述述述述述述述述述述述述述述述述述述述述述述述述述述述述述述述述述述述述述述述述述述述述述述述述述述述述述述述述述述述述述述述述述述述述述述述述述述述述述述述述述述述述述述述述述述述述述述述述述述述述述述述述述述述述述述述述述述述述述述述述述述述述述述述述述述述述述述述述述述述述述述述述述述述述述述述述述述述述述述述述述述述述述述述述述述述述述述述述述述述述述述述述述述述述述述述述述述述述述述述述述述述述述述述述述述述述述述述述述述述述述述述述述述述述述述述述述述述述述述述述述述述述述述述述述述述述述述述述述述述述述述述述述述述述述述述述述述述述述述述述述述述述述述述述述述述述述述述述述述述述述述述述述述述述述述述述述述述述述述述述述述述述述述述述述述述述述述述述述述述述述述述述述述述述述述述述述述述述述述述述述述述述述述述述述述述述述述述述述述述述述述述述述述述述述述述述述述述述述述述述述述述述述述述述述述述述述述述述述述述述述述述述述述述述述述述述述述述述述述述述述述述述述述述述述述述述述述述述述述述述述述述述述述述述述述述述述述述述述述述述述述述述述述述述述述述述述述述述述述述述述述述述述述述述述述述述述述述述述述述述述述述述述述述述述述述述述述述述述述述述述述述述述述述述述述述述述述述述述述述述述述述述述述述述述述述述述述述述述述述述述述述述述述述述述述述述述述述述述述述述述述述述述述述述述述述述述述述述述述述述述述述述述述述述述述述述述述述述述述述述述述述述述述述述述述述述述述述述述述述述述述述述述述述述述述述述述述述述述述述述述述述述述述述述述述述述述述述述述述述述述述述述述述述述述述述述述述述述述述述述述述述述述述述述述述述述述述述述述述述述述述述述述述述述述述述述述述述述述述述述述述述述述述述述述述述述述述述述述述述述述述述述述述述述述述述述述述述述述述述述述述述述述述述述述述述述述述述述述述述述述述述述述述述述述述述述述述述述述述述述述述述述述述述述述述述述述述述述述述述述述述述述述述述述述述述述述述述述述述述述述述述述述述述述述述述述述述述述述述述述述述述述述述述述述述述述述述述述述述述述述述述述述述述述述述述述述述述述述述述述述述述述述述述述述述述述述述述述述述述述述述述述述述述述述述述述述述述述述述述述述述述述述述述述述述述述述述述述述述述述述述述述述述述述述述述述述述述述述述述述述述述述述述述述述述述述述述述述述述述述述述述述述述述述述述述述述述述述述述述述述述述述述述述述述述述述述述述述述述述述述述述述述述述述述述述述述述述述述述述述述述述述述述述述述述述述述述述述述述述述述述述述述述述述述述述述述述述述述述述述述述述述述述述述述述述述述述述述述述述述述述述述述述述述述述述述述述述述述述述述述述述述述述述述述述述述述述述述述述述述述述述述述述述述述述述述述述述述述述述述述述述述述述述述述述述述述述述述述述述述述述述述述述述述述述述述述述述述述述述述述述述述述述述述述述述述述述述述述述述述述述述述述述述述述述述述述述述述述述述述述述述述述述述述述述述述述述述述述述述述述述述述述述述述述述述述述述述述述述述述述述述述述述述述述述述述述述述述述述述述述述述述述述述述述述述述述述述述述述述述述述述述述述述述述述述述述述述述述述述述述述述述述述述述述述述述述述述述述述述述述述述述述述述述述述述述述述述述述述述述述述述述述述述述述述述述述述述述述述述述述述述述述述述述述述述述述述述述述述述述述述述述述述述述述述述述述述述述述述述述述述述述述述述述述述述述述述述述述述述述述述述述述述述述述述述述述述述述述述述述述述述述述述述述述述述述述述述述述述述述述述述述述述述述述述述述述述述述述述述述述述述述述述述述述述述述述述述述述述述述述述述述述述述述述述述述述述述述述述述述述述述述述述述述述述述述述述述述述述述述述述述述述述述述述述述述述述述述述述述述述述述述述述述述述述述述述述述述述述述述述述述述述述述述述述述述述述述述述述述述述述述述述述述述述述述述述述述述述述述述述述述述述述述述述述述述述述述述述述述述述述述述述述述述述述述述述述述述述述述述述述述述述述述述述述述述",
  "pending_points": [
    "图片取得来源及商用授权情况"
  ]
}
